{
  "event_id": "evt-20260518-0001",
  "event_type": "machine_risk_assessed",
  "timestamp": "2026-05-18T10:00:00Z",
  "source": "pilier_1",
  "correlation_id": "corr-abc123",
  "machine_id": "unit_42",
  "prediction": 1,
  "status": "RISQUE_DE_PANNE",
  "risk_score": 0.91,
  "threshold": 0.7,
  "decision": "trigger_self_healing",
  "model_version": "rf-1.0.0",
  "api_latency_ms": 84,
  "estimated_time_to_failure_hours": 7.5,
  "anomaly_detected": true,
  "anomaly_score": -0.42,
  "top_contributing_sensors": ["sensor_11", "sensor_4", "sensor_20"],
  "confidence": 0.93,
  "severity": "high",
  "recommended_action": "restart_service",
  "reason": ["risk_score_above_threshold", "prediction_equals_failure"],
  "schema_version": "1.0"
}
